"Status","Start Time","Stop Time","Duration in ms","Parent Suite","Suite","Sub Suite","Test Class","Test Method","Name","Description"
"passed","Tue May 05 05:20:52 UTC 2026","Tue May 05 05:20:54 UTC 2026","2155","","GET /api/v1/users/list","","Users list has Cache-Control no-store header","","Users list has Cache-Control no-store header",""
"passed","Tue May 05 05:20:08 UTC 2026","Tue May 05 05:20:10 UTC 2026","2231","","POST /api/v1/users/create","","Create user with invalid employment status enum returns 400 VALIDATION_ERROR","","Create user with invalid employment status enum returns 400 VALIDATION_ERROR",""
"passed","Tue May 05 05:20:40 UTC 2026","Tue May 05 05:20:43 UTC 2026","2137","","GET /api/v1/users/get/:id","","Get user with malformed ID returns 404 USER_NOT_FOUND","","Get user with malformed ID returns 404 USER_NOT_FOUND",""
"passed","Tue May 05 05:23:40 UTC 2026","Tue May 05 05:23:40 UTC 2026","143","","Mail API — /api/v1/mail/*","","Create mailbox with @ in local_part returns 400 INVALID_LOCAL_PART","","Create mailbox with @ in local_part returns 400 INVALID_LOCAL_PART",""
"passed","Tue May 05 05:23:53 UTC 2026","Tue May 05 05:23:56 UTC 2026","2351","","PATCH /api/v1/users/patch/:id","","Patch only username returns 200","","Patch only username returns 200",""
"passed","Tue May 05 05:20:03 UTC 2026","Tue May 05 05:20:06 UTC 2026","2212","","POST /api/v1/users/create","","Create user with first_name shorter than 2 chars returns 400 VALIDATION_ERROR","","Create user with first_name shorter than 2 chars returns 400 VALIDATION_ERROR",""
"passed","Tue May 05 05:20:47 UTC 2026","Tue May 05 05:20:49 UTC 2026","2141","","GET /api/v1/users/list","","Get users list with per_page 100 returns 200","","Get users list with per_page 100 returns 200",""
"passed","Tue May 05 05:23:43 UTC 2026","Tue May 05 05:23:43 UTC 2026","147","","Mail API — /api/v1/mail/*","","Get message with non-existent mailbox token returns 404 MAILBOX_NOT_FOUND","","Get message with non-existent mailbox token returns 404 MAILBOX_NOT_FOUND",""
"passed","Tue May 05 05:23:40 UTC 2026","Tue May 05 05:23:40 UTC 2026","142","","Mail API — /api/v1/mail/*","","Create mailbox with local_part longer than 30 chars returns 400 INVALID_LOCAL_PART","","Create mailbox with local_part longer than 30 chars returns 400 INVALID_LOCAL_PART",""
"passed","Tue May 05 05:20:36 UTC 2026","Tue May 05 05:20:38 UTC 2026","2138","","GET /api/v1/users/get/:id","","Get user with malformed ID returns 404 USER_NOT_FOUND","","Get user with malformed ID returns 404 USER_NOT_FOUND",""
"passed","Tue May 05 05:19:09 UTC 2026","Tue May 05 05:19:12 UTC 2026","2363","","POST /api/v1/users/create","","Create user metadata fields are correct on creation","","Create user metadata fields are correct on creation",""
"passed","Tue May 05 05:20:15 UTC 2026","Tue May 05 05:20:17 UTC 2026","2260","","POST /api/v1/users/create","","VALIDATION_ERROR response contains error details","","VALIDATION_ERROR response contains error details",""
"passed","Tue May 05 05:23:39 UTC 2026","Tue May 05 05:23:39 UTC 2026","127","","Mail API — /api/v1/mail/*","","Create mailbox with valid domain returns 201","","Create mailbox with valid domain returns 201",""
"passed","Tue May 05 05:20:27 UTC 2026","Tue May 05 05:20:29 UTC 2026","2545","","DELETE /api/v1/users/delete/:id","","Delete with another user token returns 401 INVALID_TOKEN","","Delete with another user token returns 401 INVALID_TOKEN",""
"passed","Tue May 05 05:20:49 UTC 2026","Tue May 05 05:20:52 UTC 2026","2358","","GET /api/v1/users/list","","Users list response does not contain access_token or password","","Users list response does not contain access_token or password",""
"passed","Tue May 05 05:20:43 UTC 2026","Tue May 05 05:20:43 UTC 2026","136","","GET /api/v1/health","","Health response echoes provided X-Request-ID header","","Health response echoes provided X-Request-ID header",""
"passed","Tue May 05 05:20:45 UTC 2026","Tue May 05 05:20:47 UTC 2026","2167","","GET /api/v1/users/list","","Get users list with per_page 10 returns at most 10 results","","Get users list with per_page 10 returns at most 10 results",""
"passed","Tue May 05 05:21:07 UTC 2026","Tue May 05 05:21:21 UTC 2026","13657","","POST /api/v1/login","","Login response contains all required fields","","Login response contains all required fields",""
"passed","Tue May 05 05:23:44 UTC 2026","Tue May 05 05:23:44 UTC 2026","273","","Mail API — /api/v1/mail/*","","Send message returns 201 with full message object","","Send message returns 201 with full message object",""
"passed","Tue May 05 05:23:39 UTC 2026","Tue May 05 05:23:39 UTC 2026","138","","Mail API — /api/v1/mail/*","","Create mailbox with valid domain returns 201","","Create mailbox with valid domain returns 201",""
"passed","Tue May 05 05:20:43 UTC 2026","Tue May 05 05:20:45 UTC 2026","2134","","GET /api/v1/users/list","","Get users list returns 200 with pagination fields","","Get users list returns 200 with pagination fields",""
"passed","Tue May 05 05:23:46 UTC 2026","Tue May 05 05:23:46 UTC 2026","266","","Mail API — /api/v1/mail/*","","Send message missing required field body returns 400 VALIDATION_ERROR","","Send message missing required field body returns 400 VALIDATION_ERROR",""
"passed","Tue May 05 05:22:41 UTC 2026","Tue May 05 05:22:54 UTC 2026","13140","","POST /api/v1/login","","Login with empty body returns 400 VALIDATION_ERROR","","Login with empty body returns 400 VALIDATION_ERROR",""
